Name,Description,Strengths,Weaknesses,Height,Weight,40 time,RAS,10 Yard Split,20 Yard Shuttle,3-Cone Drill,Arm Length,Bench Press,Broad Jump,Hand Size,Vertical Jump,Wingspan
Addison West,"West is a developing offensive lineman with good size and competitive toughness. He displays solid anchor strength in pass protection, working to hold his ground against power rushers. In the run game, West demonstrates improving drive blocking ability, creating movement at the point of attack with proper leg drive. He shows developing awareness of stunts and blitzes, working to communicate with adjacent linemen effectively. West's hand placement is improving, working to maintain inside leverage on defenders. He plays with good effort and energy, finishing blocks when possible and looking to improve with each rep.","Size, competitive toughness, development trajectory, anchor potential, drive blocking effort, finishing mentality, communication skills, coachability, improving hand placement, work ethic","Technique needs significant refinement, foot quickness in pass protection must improve, hand placement can be inconsistent, needs to play with better leverage consistently, processing speed against complex fronts can improve, body control in space needs development",6-3,305,5.2,8.49,,,,,,,,,
Luke Lachey,"Lachey is an athletic tight end with excellent size and developing all-around skills. He displays good movement ability for his size, running fluid routes and showing burst after the catch. As a receiver, Lachey presents a large catch radius and demonstrates reliable hands, consistently plucking the ball away from his body. In the blocking game, he shows competitive toughness and improving technique, using his length and strength effectively at the point of attack. Lachey demonstrates good awareness in finding soft spots in zone coverage and has the speed to threaten the seam. He plays with high effort and energy on every snap.","Size, athleticism, catch radius, reliable hands, seam-stretching ability, blocking potential, competitive toughness, development trajectory, red zone effectiveness, effort","Route precision needs refinement, must continue adding functional strength, blocking technique is still developing, needs to improve play strength at point of attack, release package against press coverage can improve, sometimes lacks ideal short-area quickness",6-6,247,4.72,7.42,,4.47,7.18,32.125,,120,10,35,78.375
Karene Reid,"Reid is an instinctive linebacker with excellent processing speed and consistent tackling technique. He displays outstanding football intelligence, quickly diagnosing plays and taking proper angles to the ball. Against the run, Reid demonstrates good technique to stack and shed blockers, maintaining gap integrity and making tackles at the line of scrimmage. In coverage, he shows awareness in zone, understanding route combinations and passing off receivers correctly. Reid is a reliable tackler who brings proper form and leverage to the point of contact. He plays with high competitive toughness and communication skills.","Instincts, processing speed, football intelligence, tackling technique, zone coverage awareness, angles to the ball, communication skills, consistency, reliability, competitive toughness","Athletic limitations against elite athletes in space, lacks ideal size for consistent stack-and-shed, can be targeted in man coverage by athletic tight ends, speed is good but not elite, play strength can be improved",6-0,231,4.75,,,,,,,,,,
Ryan Fitzgerald,"Fitzgerald is a consistent, reliable kicker with good leg strength and accuracy. He displays solid power on kickoffs, achieving touchbacks regularly and limiting return opportunities. On field goals, Fitzgerald demonstrates good technical consistency, maintaining proper mechanics even in pressure situations. He has shown the ability to connect from 45+ yards when needed, giving his team confidence in medium to long-range attempts. Fitzgerald handles adverse weather conditions adequately, adjusting his approach based on wind and precipitation. He has demonstrated mental toughness, bouncing back from misses and maintaining confidence.","Consistency, technical soundness, mental toughness, pressure performance, weather adaptability, reliability inside 45 yards, kickoff distance, touchback percentage, focus, preparation","Leg strength on longer attempts can improve, occasionally struggles from beyond 45 yards, directional kickoffs need development, hang time on shorter kicks can increase, sometimes inconsistent from hash marks",6-1,190,5.2,,,,,,,,,,
Thomas Perry,"Perry is a powerful offensive lineman with excellent size and developing technique. He displays impressive strength at the point of attack, moving defenders in the run game with his natural power. In pass protection, Perry shows a strong anchor and improving footwork, working to mirror defenders effectively. His hand placement is developing, working to maintain inside leverage on defenders consistently. Perry demonstrates good awareness of stunts and blitzes, working well in combination with his fellow linemen. He plays with competitive toughness, finishing blocks and looking for work when unoccupied.","Size, power, anchor strength, natural strength, competitive toughness, awareness of stunts/blitzes, development trajectory, combination blocking, finishing mentality, play strength","Foot quickness in pass protection needs improvement, can struggle with speed rushers on the edge, must maintain consistent pad level, sometimes slow to adjust to second-level defenders, lateral mobility can be inconsistent",,,,8.36,,,,,,,,,
Jacob Bayer,"Bayer is a developing tight end with good size and improving receiving skills. He displays adequate movement skills, working to run cleaner routes and create separation. As a receiver, Bayer presents a solid catch radius and demonstrates improving hands, working to pluck the ball away from his body consistently. In the blocking game, he shows competitive toughness and developing technique, particularly in zone schemes where he can use his mobility. Bayer demonstrates awareness in finding soft spots in zone coverage and has the potential to develop into a reliable role player. He plays with good effort and energy on every snap.","Size, competitive toughness, development trajectory, blocking willingness, effort, zone coverage awareness, red zone potential, improving hands, work ethic, coachability","Route running needs significant refinement, athleticism is merely adequate, must add functional strength, separation ability is limited, blocking technique requires substantial development, needs to improve play speed and processing",,,,7.04,,,,,,,,,
Warren Brinson,"Brinson is a stout interior defensive lineman with good play strength and competitive toughness. He displays solid anchor ability at the point of attack, holding his ground against double teams and maintaining gap integrity. As a pass rusher, Brinson shows developing hand usage and the ability to push the pocket with bull rushes. He demonstrates good awareness of screen plays and has the motor to make plays in pursuit. Brinson plays with high effort and physicality, consistently fighting through blocks to make plays. His compact frame gives him natural leverage advantages against taller offensive linemen.","Play strength, competitive toughness, motor, physicality, leverage, anchor ability, gap integrity, screen recognition, effort, development trajectory","Athletic limitations affect pass rush potential, lateral mobility is limited, pass rush repertoire needs expansion, can struggle against athletic interior offensive linemen, sometimes lacks ideal length, penetration ability is inconsistent",6-4,310,5.09,9.1,1.76,,,33.5,,115,10.375,31,80.875
Gus Hartwig,"Hartwig is a technically sound center with excellent football intelligence and consistency. He displays good hand placement in pass protection, anchoring well against power rushers and redirecting effectively against quickness. In the run game, Hartwig demonstrates good leverage and leg drive to create movement at the point of attack. His understanding of protections and defensive fronts stands out, making accurate line calls and adjusting blocking schemes. Hartwig works well in combination blocks, efficiently transitioning from double teams to the second level. He plays with high competitive toughness and reliability.","Football intelligence, technique, hand placement, understanding of protections, leverage, combination blocking, consistency, communication skills, awareness of stunts/blitzes, reliability","Lacks elite power at point of attack, athletic limitations against exceptionally quick interior defenders, can struggle against massive nose tackles, needs to improve functional strength, occasionally plays too high affecting leverage",,,,6.57,,,,,,,,,
Alex Mastromanno,"Mastromanno is a consistent punter with good leg strength and developing directional control. He displays solid hang time on his punts, allowing coverage teams to get downfield and limit return opportunities. Mastromanno demonstrates good technique, maintaining proper mechanics even under pressure. He has shown improvement in his directional punting, working to place the ball near the sidelines and minimize return lanes. Mastromanno handles adverse weather conditions adequately, adjusting his approach based on wind and precipitation. He has shown the ability to execute various punting styles based on field position and game situation.","Leg strength, consistency, hang time, technical soundness, directional potential, weather adaptability, versatility in punt styles, developmental trajectory, composure under pressure, work ethic","Directional accuracy can be inconsistent, occasionally outkicks coverage, must improve placement inside the 20-yard line, sometimes sacrifices hang time for distance, needs to develop greater consistency in adverse conditions",6-1,241,4.8,,,,,,,,,,
Drew Kendall,"Kendall is a technically sound center with good athletic traits and developing strength. He displays solid footwork in pass protection, mirroring defenders and maintaining proper positioning. In the run game, Kendall demonstrates good mobility, effectively reaching defenders on outside zone plays and climbing to the second level. His understanding of protections and defensive fronts is improving, working to make accurate line calls and adjust blocking schemes. Kendall works well in combination blocks, showing good awareness and timing when transitioning from double teams to the second level. He plays with competitive toughness and improving technique.","Athletic traits, technique, footwork, mobility, awareness, combination blocking, development trajectory, zone blocking ability, second-level blocking, competitive toughness","Play strength needs significant development, must add functional strength to his frame, can be susceptible to power rushes, anchor strength must improve, sometimes struggles against massive nose tackles, occasionally overpowered at point of attack in space can be improved",6-4,308,5.05,9.21,1.79,4.51,7.56,31.75,,,9.625,,77.5
Jack Kiser,"Kiser is an intelligent linebacker with excellent instincts and leadership qualities. He displays outstanding processing speed, quickly diagnosing plays and taking proper angles to the ball. Against the run, Kiser demonstrates good technique to stack and shed blockers, maintaining gap integrity and making tackles at the line of scrimmage. In coverage, he shows awareness in zone, understanding route combinations and passing off receivers correctly. Kiser is a reliable tackler who brings proper form and leverage to the point of contact.","Football intelligence, instincts, processing speed, leadership, tackling technique, zone coverage awareness, angles to the ball, communication skills, consistency, reliability","Athletic limitations against elite athletes in space, lacks ideal size for consistent stack-and-shed, can be targeted in man coverage by athletic tight ends, speed is good but not exceptional, play strength can be improved",6-2,231,4.68,7.68,,,,30.375,,,9,,75.5
Luke Kandra,"Kandra is a powerful interior offensive lineman with good play strength and competitive toughness. He displays impressive anchor strength in pass protection, rarely getting pushed back into the pocket. In the run game, Kandra generates movement at the point of attack, creating lanes with his powerful drive blocking. He shows good awareness of stunts and blitzes, working well in combination with adjacent linemen. Kandra demonstrates improving hand technique, resetting effectively when defenders attempt to disengage.","Play strength, anchor, power in run game, competitive toughness, awareness of stunts/blitzes, hand usage, drive blocking ability, finishing mentality, development trajectory, combination blocking","Athletic limitations against quicker interior defenders, lateral mobility in space needs improvement, occasionally plays too high affecting leverage, hand placement can be inconsistent, must improve body control in space",6-5,319,4.9,9.34,,,,31.875,,,10,,80.5
Jordan Hancock,"Hancock is a fluid cornerback with excellent coverage skills and developing ball production. He displays smooth transitions in his backpedal and has the speed to carry receivers vertically. Hancock excels in man coverage, mirroring receivers' movements and staying in phase throughout routes. His technique at the line of scrimmage is improving, showing patience and proper hand placement in press coverage. In zone, Hancock demonstrates good awareness and route recognition, breaking quickly on throws in front of him. He shows competitive toughness at the catch point, challenging receivers and disrupting passes.","Coverage skills, athleticism, transitions, speed, man coverage ability, competitive toughness, route recognition, developing press technique, breaking on the ball, recovery speed","Ball production needs to increase, tackling technique in open field can improve, play strength against larger receivers must develop, needs to be more consistent in run support, occasional lapses in zone spacing",6-0,195,4.45,9.82,,,,30.75,,,8.625,,76.125
Jarquez Hunter,"Hunter is an explosive running back with excellent burst and big-play ability. He displays impressive vision, quickly identifying running lanes and making decisive cuts. Hunter accelerates rapidly through holes and has the top-end speed to break long runs when he finds daylight. He runs with good balance and forward lean, consistently falling forward for extra yardage. As a receiver, Hunter shows reliable hands and the route-running ability to create mismatches out of the backfield. He demonstrates competitive toughness, always fighting for extra yards.","Burst, acceleration, big-play ability, vision, cutting ability, top-end speed, balance, receiving potential, competitive toughness, third-down value","Frame lacks ideal size for consistent between-the-tackles running, pass protection technique needs refinement, must improve blitz recognition, can be too hesitant at times, needs to develop more power to break tackles consistently",5-9,204,4.44,7.16,1.58,,,30,21,120,9.5,33,72.625
Kyle Williams,"Williams is a smooth, fluid receiver with excellent route-running precision and reliable hands. He displays the ability to create separation at all three levels of the field, using subtle head fakes and body control to deceive defenders. At the catch point, Williams shows strong hands and concentration, making difficult catches look routine. After the catch, he demonstrates good vision and enough elusiveness to create additional yardage. Williams has a good understanding of coverages, finding soft spots in zones and adjusting his routes accordingly.","Route running, separation ability, hands, body control, concentration at catch point, adjusting to the ball, understanding of coverages, release package, flexibility, intermediate route tree","Play strength needs development, can struggle against physical press coverage, must improve as a blocker in the run game, top-end speed is good but not elite, YAC ability is solid but not exceptional",6-0,186,4.4,6.33,1.55,,,30.125,,119,8.75,36,73
Alijah Huzzie,"Huzzie is an instinctive cornerback with excellent ball skills and quick-twitch athleticism. He displays fluid hips in coverage, transitioning smoothly from backpedal to forward movement. In man coverage, Huzzie demonstrates the ability to mirror receivers' movements and the speed to carry them vertically. He excels in zone coverage, showing advanced route recognition and the ability to jump passing lanes for interceptions. Huzzie is competitive at the catch point, using his timing and leaping ability to disrupt passes. Against the run, he is a willing tackler who takes good angles to the ball carrier.","Ball skills, instincts, athleticism, fluid hips, route recognition, playmaking ability, zone coverage skills, transitions, competitive at catch point, quickness","Size limitations could affect matchups with bigger receivers, tackling technique in space needs refinement, occasionally takes risks jumping routes, must improve play strength against physical receivers, can be overaggressive in press coverage",5-10,193,4.55,,,,,29.625,,,8.625,,72.625
Donovan Edwards,"Edwards is a dynamic running back with exceptional receiving ability and big-play potential. He displays excellent burst and acceleration, quickly reaching top speed and outrunning pursuit angles. As a runner, Edwards shows improving vision and patience, setting up blocks and finding cutback lanes. His greatest asset is his receiving ability, demonstrating route-running skills and hands comparable to wide receivers. Edwards creates mismatches in the passing game, particularly against linebackers in coverage. He runs with good balance and competitive toughness, consistently fighting for extra yards.","Receiving ability, burst, acceleration, big-play potential, route running, hands, mismatch creation, versatility, speed, space production","Between-the-tackles running needs development, must improve in pass protection, vision can be inconsistent, needs to run with more consistent pad level, occasionally dances too much looking for the big play",5-11,205,4.44,9.78,1.51,,,30,23,,10,38,74.625
Tyler Batty,"Batty is a powerful edge defender with good play strength and technical refinement. He displays impressive strength at the point of attack, setting a firm edge against the run and controlling offensive tackles. As a pass rusher, Batty combines power moves with improving finesse, showing the ability to convert speed to power effectively. He demonstrates good awareness of screen plays and has the motor to make plays in pursuit. Batty plays with high effort and physicality, wearing down opponents throughout the game.","Play strength, edge-setting ability, technical refinement, power as a pass rusher, awareness, motor, physicality, play recognition, hand usage, competitive toughness","Athletic limitations affect bend around the edge, lacks elite first-step quickness, can struggle against athletic tackles in space, needs to develop more counter moves as a pass rusher, change of direction ability is merely adequate",6-5,275,4.78,8.76,1.69,4.54,7.21,33.125,27,120,9.375,34,81
Nick Nash,"Nash is a versatile athlete with experience at multiple positions and developing skills. He displays good athleticism and competitive toughness, showing the ability to contribute in various roles. As a receiver, Nash demonstrates reliable hands and improving route-running ability, using his size effectively against smaller defensive backs. He shows good awareness finding soft spots in zone coverage and the toughness to make catches in traffic. Nash's background at quarterback gives him good field vision and understanding of offensive concepts, helping him adjust to different situations.","Versatility, athleticism, competitive toughness, reliable hands, size, zone coverage awareness, field vision, adaptability, special teams value, development trajectory","Route precision needs refinement, release package against press coverage must improve, lacks elite top-end speed, position-specific technique requires development, needs to improve blocking in the run game",6-2,203,4.57,5.99,1.54,,,31,,123,8.75,34,76.5
Tommi Hill,"Hill is an athletic cornerback with excellent length and developing coverage skills. He displays fluid movements in his backpedal and transitions, showing the ability to change direction quickly. In press coverage, Hill uses his length effectively to disrupt receivers at the line of scrimmage. He demonstrates good ball skills, timing his jumps well and using his length to bat away passes. Hill shows competitive toughness at the catch point, challenging receivers and disrupting passes. Against the run, he is a willing tackler who takes good angles to the ball carrier.","Length, athleticism, press coverage potential, ball skills, competitive toughness, transitions, recovery speed, development trajectory, physical tools, disruption at line of scrimmage","Technique needs refinement, can get overaggressive in press coverage leading to penalties, route recognition in zone coverage must improve, tackling technique can be inconsistent, needs to develop better awareness of route combinations",6-0,213,4.55,,,,,32.875,,,9,,79.5
Tyrion Ingram-Dawkins,"Ingram-Dawkins is a disruptive interior defensive lineman with excellent quickness and developing power. He displays impressive first-step quickness, often beating offensive linemen off the snap and penetrating the backfield. As a pass rusher, Ingram-Dawkins shows good hand usage and the ability to win with both power and finesse moves. Against the run, he is developing the strength to hold his ground against double teams and the quickness to shoot gaps and make plays in the backfield. Ingram-Dawkins plays with high motor and effort, rarely giving up on plays even when initially blocked.","First-step quickness, penetration ability, pass rush potential, hand usage, motor, backfield disruption, developing power, competitive toughness, gap-shooting ability, playmaking upside","Consistency against the run needs improvement, must continue adding functional strength, can get washed out by double teams, needs to maintain gap discipline, sometimes plays too high affecting leverage",,,,9.79,,,,,,,,,
Howard Cross III,"Cross is a compact, powerful interior defensive lineman with excellent leverage and hand usage. He displays impressive strength at the point of attack, anchoring against double teams and maintaining gap integrity. As a pass rusher, Cross uses his natural leverage advantage and quick hands to split double teams and pressure the quarterback. He demonstrates good awareness of screen plays and has the lateral quickness to make plays in pursuit. Cross plays with high motor and physicality, consistently fighting through blocks to make plays.","Leverage, hand usage, strength at point of attack, gap integrity, motor, physicality, awareness, quickness for size, splitting double teams, consistency","Size limitations could affect matchups with bigger offensive linemen, lacks ideal length, pass rush repertoire needs expansion, can be overwhelmed by size at times, limited scheme versatility due to physical traits",,,,4.69,,,,32.25,,104,10.5,29,78.625
Jalen Travis,"Travis is a massive offensive tackle with rare length and natural power at the point of attack. His wingspan creates an enormous pass protection radius that makes it difficult for edge rushers to navigate around him. In the run game, he generates significant movement with his natural strength and size when he plays with proper leverage. Travis shows good hand placement and the ability to latch onto defenders and control them once engaged. His length allows him to recover when initially beaten, providing a margin for error in his technique. Travis demonstrates developing footwork in his pass sets, showing the coordination to reach his landmarks against most edge rushers.","Size and length, power at point of attack, natural strength, pass protection radius, recovery potential, hand placement, movement skills for size, drive blocking ability","Pad level consistency needs improvement, lateral agility against speed rushers can be improved, sometimes relies too much on size over technique, hand timing can be refined, occasionally struggles with counter moves, bend and flexibility limitations",6-8,339,5.14,9.07,1.8,,,34.875,,112,10.5,35,83.5
CJ Dippre,"Dippre is a well-rounded tight end with good blocking ability and developing receiving skills. He displays excellent strength at the point of attack, effectively sealing defenders in the run game and anchoring in pass protection. As a receiver, Dippre shows reliable hands and good body control, making catches away from his frame and adjusting to poorly thrown balls. He demonstrates good awareness in finding soft spots in zone coverage and has enough speed to threaten the seam. Dippre plays with high competitive toughness, finishing blocks and fighting for extra yards after the catch.","Blocking ability, strength at point of attack, reliable hands, competitive toughness, body control, zone coverage awareness, YAC effort, versatility, red zone effectiveness, development trajectory","Athletic limitations affect separation against man coverage, route running needs refinement, lacks elite speed to consistently stretch the field, change of direction ability is merely adequate, sometimes labors in and out of breaks",6-5,256,4.69,8.72,1.56,,,32,32,120,9.625,,79.75
