Name,Description,Strengths,Weaknesses,Height,Weight,40 time,RAS,10 Yard Split,20 Yard Shuttle,3-Cone Drill,Arm Length,Bench Press,Broad Jump,Hand Size,Vertical Jump,Wingspan
Dylan Fairchild,"Fairchild is a powerful interior offensive lineman with good athleticism and competitive toughness. He displays impressive strength at the point of attack, moving defenders in the run game with powerful drive blocking. In pass protection, Fairchild shows a strong anchor and good lateral mobility to mirror interior rushers. His hand placement is consistently inside, and he resets effectively when defenders try to disengage. Fairchild demonstrates good awareness of stunts and blitzes, working well in combination with his fellow linemen.","Power at point of attack, athletic traits, hand placement, awareness of stunts/blitzes, drive blocking ability, strong anchor, competitive toughness, finishing mentality","Occasionally plays too high affecting leverage, can improve body control in space, needs to maintain consistent pad level throughout games, developing consistency in pass protection",6-5,318,5.15,,1.79,,,33,,111,10,27,80.75
Oluwafemi Oladejo,"Oladejo is an athletic, rangy linebacker with excellent sideline-to-sideline speed and pursuit ability. He possesses natural instincts for finding the football and takes efficient angles to ball carriers. His length and frame allow him to effectively stack and shed blocks while maintaining good position in run defense. In coverage, Oladejo shows fluid hip movement and the ability to match with running backs and tight ends in man coverage. His closing burst and tackling radius stand out when playing downhill, allowing him to limit yards after contact.","Range and pursuit speed, tackling form, length and frame, coverage instincts, closing burst, block shedding, athletic traits, tackling radius","Can be a step slow in play diagnosis, needs to improve taking on blocks directly, occasionally overpursues angles, pass rush technique needs development, inconsistent play strength",6-3,259,4.7,,,,,33.375,20,120,9.75,36,82.125
RJ Harvey,"Harvey is an explosive running back with outstanding burst and acceleration through the hole. He possesses excellent vision to identify cutback lanes and the agility to quickly change direction without losing speed. His contact balance is impressive, allowing him to run through arm tackles and maintain balance after initial contact. Harvey displays natural receiving skills out of the backfield and can be a mismatch against linebackers in coverage. His home run ability stands out, capable of turning routine plays into explosive gains with his combination of speed and elusiveness.","Burst and acceleration, contact balance, vision, change of direction, receiving ability, explosive play potential, elusiveness in space, yards after contact","Pass protection technique needs refinement, ball security concerns in traffic, can improve route running precision, needs more consistency in blitz pickup, somewhat limited power running experience",5-8,205,4.4,8.49,,,,,,,,,
Clay Webb,Webb is a technically refined interior offensive lineman with excellent hand placement and leverage understanding. He demonstrates good lateral mobility to reach defensive tackles and linebackers on zone concepts. His football intelligence stands out in his ability to identify stunts and blitzes pre-snap and adjust protection calls accordingly. Webb displays solid anchor strength in pass protection and works well in combination blocks. His ability to climb to the second level while maintaining balance and body control is a significant asset in the run game.,"Technical refinement, hand placement, football IQ, leverage awareness, lateral movement skills, combination blocks, second level targeting, pass protection fundamentals","Play strength can be inconsistent, needs to improve lower body power, can struggle with powerful nose tackles, durability concerns, lacks elite athleticism",6-3,310,5.11,8.6,1.72,4.9,,32,,107,10,31,79.5
Dorian Strong,"Strong is a fluid cornerback with excellent length and ball skills. His long frame and wingspan allow him to contest catches and disrupt passing lanes effectively. He demonstrates smooth hip turn and transition when flipping to run with receivers vertically. Strong's press technique utilizes his length well to disrupt timing and routes at the line of scrimmage. In zone coverage, he shows good pattern recognition and awareness to anticipate throws. His tackling is reliable, especially against the run where he takes good angles and breaks down effectively in space.","Length and wingspan, ball skills, hip fluidity, press technique, zone awareness, tackling fundamentals, route recognition, vertical coverage ability","Can improve play strength against physical receivers, occasional false steps in quick-breaking routes, needs more consistent jam technique, can be targeted in run support, sometimes relies too much on athleticism",6-1,185,4.5,7.03,1.55,,,30.875,15,116,9.25,36,76.125
Zah Frazier,"Frazier is a disruptive defensive lineman with exceptional first-step quickness and backfield penetration ability. He displays impressive hand fighting techniques to defeat blocks and create immediate pressure. His motor runs consistently hot, pursuing plays downfield and showing relentless effort throughout games. Frazier possesses good flexibility to bend around the edge and flatten to the quarterback while maintaining speed. His versatility allows him to align at multiple positions across the defensive front. In the run game, he shows good gap discipline while still maintaining his disruptive presence.","First-step explosion, hand fighting technique, motor, bend and flexibility, versatility, backfield disruption, pursuit effort, pass rush potential","Needs to add functional strength, can be controlled by double teams, sometimes plays too upright, run defense consistency needs improvement, can add more counters to pass rush arsenal",,,,9.35,1.51,4.26,7,32.875,,126,8.25,36,80.125
Tyler Baron,"Baron is a powerful edge defender with excellent length and the ability to set a firm edge against the run. He possesses impressive upper body strength to stack and shed blockers and maintain gap integrity. His bull rush is particularly effective, showing the ability to collapse the pocket and push tackles into the quarterback's lap. Baron displays good hand usage and the ability to convert speed to power effectively. His motor runs consistently and he pursues plays with good effort and intensity. As a run defender, he shows discipline in maintaining containment while still making plays.","Edge setting ability, length, power at point of attack, bull rush effectiveness, play strength, hand usage, motor, gap discipline, run defense","Lacks elite bend around the edge, change of direction can be improved, pass rush repertoire needs expansion, first step is good not great, sometimes plays with high pad level",6-5,260,4.62,8.64,1.61,,,33.125,19,121,10,35,80.25
Jackson Slater,"Slater is an athletic offensive tackle with excellent foot quickness and pass protection upside. He demonstrates smooth kick-slide technique and the ability to mirror pass rushers in space. His hand placement is consistent and he shows solid understanding of leverage in both pass and run blocking. Slater possesses good length and uses it well to keep defenders at bay. In the run game, he displays the mobility to execute zone schemes effectively and reach second-level defenders. His competitive toughness and finishing mentality stand out when driving defenders off the ball.","Foot quickness, kick-slide technique, hand placement, length, mirroring ability, zone blocking potential, second level mobility, competitive toughness","Play strength needs development, anchor can be inconsistent against power rushers, sometimes overextends in space, needs more functional power in run game, can improve hand strength",6-3,311,5.01,9.37,1.78,,,32,,108,10,28,78.5
Logan Brown,"Brown is a massive offensive tackle with rare length and natural power. His wingspan creates an enormous pass protection radius that makes it difficult for edge rushers to get around him. In the run game, he generates significant movement at the point of attack with his natural strength and mass. Brown displays solid hand placement and the ability to latch onto defenders and control them once engaged. His length allows him to recover when initially beaten, providing a significant margin for error. When he plays with proper leverage, he can be a dominant force in both phases of the game.","Size and length, power at point of attack, drive blocking potential, pass protection radius, recovery ability, hand placement, movement skills for size, finishing strength","Inconsistent pad level, lateral agility can improve, sometimes relies too much on size over technique, bend and flexibility limitations, can struggle with speed rushers, hand placement consistency",6-6,311,5.18,9.49,1.75,4.51,7.75,33.875,,111,10,32,84
Malachi Moore,"Moore is a versatile defensive back with excellent instincts and football intelligence. He processes plays quickly and shows advanced route recognition abilities. His versatility allows him to line up at multiple positions in the secondary including slot corner, deep safety, and in the box. Moore takes precise angles in run support and is a reliable open-field tackler. In coverage, he demonstrates fluid movement skills and the ability to transition quickly from backpedal to break. His ball skills are excellent, showing natural hands and timing when playing the ball in the air.","Versatility, football IQ, route recognition, tackling technique, positional flexibility, ball skills, play diagnosis, coverage awareness","Play strength can improve, sometimes takes calculated risks that backfire, can add bulk to hold up in the box, deep speed is good not elite, occasionally overaggressive in run support",5-11,196,4.5,,,,,29.625,,,9,,75.25
Jonas Sanker,"Sanker is a physical, downhill safety with impressive play recognition and run defense instincts. He diagnoses plays quickly and takes direct angles to the ball carrier, arriving with authority at the point of contact. His tackling technique is fundamentally sound with good form and follow-through. Sanker demonstrates solid zone coverage awareness, maintaining proper depth and positioning while keeping plays in front of him. He contributes effectively in blitz packages, timing his rushes well and finishing when he reaches the backfield. His versatility allows him to line up at multiple spots in the defensive backfield.","Physical play style, tackling technique, run support, play recognition, blitz effectiveness, zone coverage awareness, versatility, football intelligence","Man coverage limitations against shifty receivers, deep range needs refinement, change of direction skills can be improved, sometimes takes overly aggressive angles, ball skills in contested situations need development",6-0,206,4.48,7.06,1.51,,,32.25,12,,9.75,,77.625
Que Robinson,"Robinson is an explosive edge defender with excellent first-step quickness and bend around the corner. He demonstrates impressive flexibility to flatten to the quarterback while maintaining speed through his rush arc. His length is an asset in creating separation from offensive tackles and extending to make plays outside his frame. Robinson possesses good hand fighting technique, showing developing moves to defeat blocks and clear his path to the quarterback. In run defense, he's working to become more consistent at setting the edge and maintaining containment responsibilities. His closing burst allows him to quickly close ground and finish plays when he has a clear path to the ball.","First-step explosion, bend, flexibility, length, hand fighting potential, closing burst, pass rush upside, athletic traits","Run defense consistency needs improvement, can be moved in the run game, sometimes loses containment, play strength at point of attack needs development, pass rush plan can be more refined, occasionally relies too much on athleticism",6-5,241,4.6,,,,,33.5,,,9.625,,80.125
Elijah Roberts,"Roberts is a disruptive defensive lineman with excellent first-step quickness and penetration ability. He possesses good leverage and uses his hands effectively to shed blocks and maintain gap integrity. His motor runs consistently hot, pursuing plays downfield with urgency and effort. Roberts displays versatility along the defensive front, capable of aligning at multiple techniques. In pass rush situations, he shows good initial burst and the ability to collapse the pocket from the interior. His natural strength allows him to hold his ground against double teams and redirect running backs in the backfield.","First-step quickness, hand fighting technique, motor, versatility, leverage, gap integrity, penetration ability, pass rush potential","Needs to add more functional strength, pass rush moves need refinement, sometimes plays too high, lateral movement can improve, needs to develop counter moves, occasional overaggression opens running lanes",6-4,278,4.78,6.82,1.67,,,33.625,,116,10.25,31,82.5
DJ Giddens,"Giddens is a well-rounded running back with excellent vision and patience behind the line of scrimmage. He possesses good burst through the hole once he identifies his running lane and accelerates quickly to the second level. His contact balance stands out, allowing him to run through arm tackles and maintain his balance after initial contact. Giddens demonstrates good receiving skills out of the backfield with reliable hands and the ability to create after the catch. In pass protection, he shows willingness and good technique in picking up blitzers. His running style combines power and elusiveness, making him effective in various offensive schemes.","Vision, patience, burst, contact balance, receiving ability, pass protection willingness, running versatility, second-level acceleration","Top-end speed is good not elite, sometimes hesitates too long at the line, ball security can improve in traffic, route running depth and precision need refinement, needs to improve lower body strength",6-0,212,4.43,9.78,1.53,4.33,,30.375,,130,9.25,39,75.25
Nohl Williams,"Williams is a technically sound cornerback with excellent footwork and short-area quickness. He demonstrates advanced route recognition skills and the ability to anticipate and jump routes effectively. His change of direction ability allows him to stay in phase with receivers through their breaks. Williams shows good ball skills with the ability to locate and play the ball at its highest point. In press coverage, he uses good hand placement and timing to disrupt receivers' releases. His tackling is reliable, especially against screen passes and quick throws where he closes quickly and finishes with proper form.","Footwork, route recognition, short-area quickness, ball skills, change of direction ability, press technique, tackling reliability, anticipation","Play strength can improve against physical receivers, deep speed is good not elite, can add more muscle to frame, sometimes overly aggressive in jump-ball situations, run support consistency needs development",6-0,199,4.5,7.12,1.54,,,30.75,19,120,9,33,75.5
Cody Simon,"Simon is an instinctive linebacker with excellent play recognition and processing speed. He diagnoses plays quickly and takes efficient angles to the ball carrier. His sideline-to-sideline range allows him to make plays across the field and limit explosive gains. Simon displays good coverage skills for the position, with the ability to match with running backs and tight ends in man coverage. His tackling technique is fundamentally sound, breaking down in space and wrapping securely. In blitz packages, he shows good timing and the ability to find gaps in the offensive line. His leadership and communication skills help coordinate the defensive front.","Play recognition, processing speed, range, coverage ability, tackling technique, blitz timing, leadership, communication skills","Can improve taking on blocks directly, play strength at point of attack needs development, sometimes overruns plays, pass rush moves could be expanded, occasionally caught out of position in complex coverage schemes",6-2,229,4.5,8.35,,,,31.25,,,9.75,,75.75
Ajani Cornelius,"Cornelius is a powerful offensive tackle with impressive physical tools and developmental upside. He possesses excellent length and natural strength to control defenders once engaged. In pass protection, he shows good anchor ability against bull rushers and the length to redirect edge speed. His hand placement is improving and he demonstrates the ability to reset when initially beaten. In the run game, Cornelius generates good movement at the point of attack with his natural power and drive. His foot quickness for his size is notable, allowing him to reach landmarks in pass sets and execute zone blocking concepts.","Length, natural strength, anchor ability, power at point of attack, developmental upside, foot quickness for size, recovery potential, competitive toughness","Technical refinement needed in pass sets, hand placement consistency can improve, sometimes plays with high pad level, needs to improve against counters and speed-to-power moves, lateral agility in space needs work",6-5,315,5.15,,,,,33.5,,,9.5,,82
Jah Joyner,"Joyner is an explosive edge defender with excellent first-step quickness and bend around the corner. He shows impressive flexibility to flatten to the quarterback while maintaining speed through his rush. His hand usage continues to develop, showing the ability to swipe and clear tackles' hands to create separation. Joyner possesses good length and uses it to create leverage against offensive tackles. His motor runs consistently hot, pursuing plays downfield and making effort tackles. In run defense, he's improving at setting the edge and maintaining gap discipline while still being disruptive.","First-step explosion, bend, flexibility, length, motor, pursuit effort, pass rush potential, athletic traits","Needs to add functional strength, can be controlled in run game, pass rush plan needs refinement, sometimes plays too narrow, run defense technique needs development, can add more counters to pass rush arsenal",6-5,265,4.6,6.86,1.67,4.68,7.33,34,,,9.375,30,82.5
Mitchell Evans,"Evans is a versatile tight end with excellent size and receiving ability. He presents a large target with a wide catch radius and reliable hands to secure throws away from his frame. His route running is developing, showing good understanding of leverage and how to find soft spots in zone coverage. After the catch, Evans demonstrates good contact balance and the ability to gain additional yardage. As a blocker, he shows willingness and improving technique, using his size and length to seal defenders in the run game. His red zone presence is notable, using his frame to box out defenders and make contested catches.","Size, catch radius, reliable hands, red zone threat, contact balance, versatility, blocking willingness, yards after catch ability","Route precision needs refinement, separation quickness can improve, blocking technique is still developing, needs to improve play strength, change of direction skills are adequate not elite, sometimes rounds off routes",6-5,258,4.74,7.25,1.55,4.4,7.25,31.875,,115,9.5,,77
Jamon Dumas-Johnson,"Dumas-Johnson is a physical, downhill linebacker with excellent instincts and run defense ability. He diagnoses plays quickly and attacks the line of scrimmage with authority. His tackling is a strength, delivering powerful hits and wrapping securely to finish plays. Dumas-Johnson displays good block shedding technique, using his hands effectively to disengage and find the ball carrier. In pass coverage, he shows awareness in zone drops and the ability to match short routes. His blitz timing is excellent, finding gaps in the offensive line and creating pressure up the middle. His field awareness and communication help coordinate the defensive front.","Physicality, run defense, tackling power, instincts, block shedding, blitz timing, downhill playing style, play diagnosis","Coverage range in space is limited, change of direction can improve, sometimes over-commits to run fakes, man coverage against athletic tight ends needs work, lateral range is good not great, occasionally overpursues",6-1,238,4.5,8.98,,,,,,,,,
Chase Lundt,"Lundt is a fundamentally sound offensive lineman with excellent power and anchor in pass protection. He demonstrates good hand placement and the ability to reset against counter moves. His football intelligence stands out in his ability to identify blitzes and communicate protection adjustments pre-snap. In the run game, Lundt generates good movement at the point of attack with his natural leverage and leg drive. He works well in combination blocks, displaying good awareness and timing when climbing to the second level. His competitive toughness and finishing mentality are evident in his consistent effort to drive defenders off the ball.","Hand placement, power, anchor, football IQ, communication skills, run blocking power, combination block execution, competitive toughness","Lateral mobility can be improved, sometimes struggles with speed rushers, can play with high pad level, footwork in space needs refinement, recovery quickness after initial loss can improve",6-8,305,5.4,6.45,,,,32.625,,,9.625,,77.75
Jaylen Reed,"Reed is a versatile safety with excellent play recognition and downhill closing speed. He processes quickly and takes efficient angles to the ball carrier, arriving with explosive hitting power. His tackling technique is fundamentally sound, breaking down in space and wrapping with proper form. Reed displays good coverage instincts in zone, maintaining proper depth and positioning while keeping plays in front of him. In man coverage, he shows the athleticism to match with tight ends and running backs. His blitz timing is notable, disguising his intentions and creating pressure when called upon.","Play recognition, closing speed, tackling technique, hitting power, coverage instincts, blitz effectiveness, versatility, downhill explosiveness","Deep range needs refinement, can be overaggressive at times leading to missed tackles, man coverage against shifty receivers needs work, ball skills in contested situations can improve, sometimes takes risks in coverage",6-0,211,4.49,9.09,1.51,,,30.375,19,,9,,74.25
Miles Frazier,"Frazier is a powerful offensive lineman with impressive strength at the point of attack. He generates significant movement in the run game with his natural power and consistent leg drive. In pass protection, Frazier shows good anchor ability against bull rushers and the hand strength to control defenders once engaged. His awareness for stunts and blitzes continues to develop, showing improved recognition and reaction. Frazier displays positional versatility, having played multiple spots along the offensive line. His competitive toughness and finishing mentality are evident in his effort to drive defenders off the ball and play through the whistle.","Power at point of attack, anchor strength, hand strength, run blocking effectiveness, versatility, competitive toughness, finishing mentality, drive blocking ability","Lateral mobility needs improvement, sometimes struggles with speed rushers, hand placement consistency can improve, footwork in space needs refinement, recovery quickness after initial loss is limited",,,,9.32,,,,32.75,,108,9,31,81.25
Upton Stout,"Stout is a quick-twitch cornerback with excellent short-area burst and recovery speed. He transitions smoothly from backpedal to break on the ball, showing impressive closing speed. His ball skills are advanced, with natural hands and timing when playing the ball in the air. Stout demonstrates good route recognition, particularly on short and intermediate patterns. In press coverage, he shows developing technique with quick feet and active hands to disrupt timing. His competitive nature is evident in his willingness to support the run despite his frame. Stout's change of direction ability allows him to stay in phase with receivers through their breaks.","Short-area quickness, recovery speed, ball skills, transition ability, route recognition, competitive toughness, change of direction ability, closing burst","Play strength needs development, can struggle against physical receivers, tackling technique is inconsistent, sometimes relies too much on athleticism, deep ball tracking needs refinement",5-9,182,4.44,7.6,1.51,4.29,,30,21,128,9,37,74.375
Kobe King,"King is an instinctive linebacker with excellent play recognition and downhill attacking ability. He diagnoses plays quickly and takes direct angles to the ball carrier, filling gaps with authority. His tackling technique is fundamentally sound, breaking down in space and delivering powerful hits. King displays good block shedding ability, using his hands effectively to disengage and find the ball. In coverage, he shows awareness in zone drops and the ability to match short routes. His blitz timing is excellent, finding gaps in the offensive line and creating interior pressure. King's leadership and communication skills help coordinate the defensive front.","Play recognition, instincts, downhill attacking, tackling technique, block shedding, blitz timing, leadership, gap filling ability","Coverage range can be limited, change of direction needs improvement, sometimes overpursues angles, man coverage against athletic tight ends needs development, lateral range is good not great",6-1,236,4.68,8.03,,,,31.25,,,9.5,,78.625
