Name,Description,Strengths,Weaknesses,Height,Weight,40 time,RAS,10 Yard Split,20 Yard Shuttle,3-Cone Drill,Arm Length,Bench Press,Broad Jump,Hand Size,Vertical Jump,Wingspan
Mason Taylor,"Taylor is a versatile modern tight end with impressive receiving skills and developing blocking ability. He runs crisp routes with attention to detail, showing the ability to set up defenders with subtle head fakes and body movements. Taylor creates separation with good footwork at the top of routes and finds soft spots against zone coverage effectively. His hands are reliable, catching the ball cleanly away from his body. After the catch, Taylor shows good vision and enough strength to break tackles. As a blocker, he displays proper technique and competitive toughness despite his leaner frame.","Route-running precision, reliable hands, separation ability, zone coverage awareness, yards-after-catch ability, developing blocking technique, competitive toughness, positional versatility","Still adding functional strength for inline blocking, occasionally body catches instead of using hands, needs improved play strength at point of attack, developing consistency as a blocker",6-5,251,4.64,8.87,,,,32.25,,,10,,78.75
Maxwell Hairston,"Hairston is an athletic cornerback with excellent ball skills and developing technical refinement. He possesses outstanding speed and change-of-direction ability, allowing him to match up with receivers in man coverage and recover when initially beaten. Hairston shows improved route recognition, anticipating breaks and closing quickly on underneath routes. His ball skills are a significant asset, with the hands and body control to secure interceptions. Hairston tackles with good form despite his leaner frame, breaking down in space and taking proper angles in pursuit.","Speed, ball skills, change-of-direction ability, recovery speed, man coverage potential, playmaking ability, tackling technique, competitive toughness","Still developing play strength against physical receivers, needs to improve press technique, occasional false steps in transition, developing zone awareness",5-11,183,4.28,9.63,1.5,,,31,,129,8.75,39,76.875
Xavier Watts,"Watts is a versatile defensive back with excellent instincts, ball skills, and playmaking ability. He processes information rapidly, reading quarterbacks' eyes and breaking on passes with anticipation. Watts' ball skills are exceptional, with the hands and body control to secure interceptions when opportunities arise. His tackling is technically sound, taking proper angles and finishing with good form. Watts displays versatility to play multiple positions in the secondary, with the awareness and football IQ to handle various responsibilities.","Ball skills, instincts, tackling technique, versatility, play recognition, football intelligence, competitive toughness, adaptability","Could add functional strength for durability at the next level, occasionally overaggressive jumping routes, needs to improve taking on blocks when playing close to the line of scrimmage",6-0,204,4.49,5.8,,,,31.5,,,8.625,,76.5
Carson Schwesinger,"Schwesinger is an instinctive linebacker with excellent play recognition and tackling ability. He processes quickly, recognizing plays and triggering downhill with decisiveness. Schwesinger takes proper angles in pursuit, limiting cutback lanes and finishing tackles with good form. In coverage, he shows awareness in zone and the athleticism to match up with running backs in man coverage. Schwesinger's football IQ is evident in how he communicates and adjusts the defense pre-snap, quickly recognizing offensive formations and tendencies.","Play recognition, tackling technique, football intelligence, communication skills, zone coverage awareness, block shedding, reliability, consistency","Athletic limitations against elite athletes in space, still developing man coverage technique, needs to improve disengaging from offensive linemen at point of attack",6-2,242,4.7,,,,,31.625,20,,9.25,39,77.5
Elijah Arroyo,"Arroyo is an athletic tight end with impressive receiving skills and developing blocking ability. He creates separation with fluid route running and good footwork at the top of routes. Arroyo's hands are reliable, catching the ball cleanly away from his body and securing it through contact. His athleticism allows him to be a vertical threat up the seam, with the speed to stretch defenses and create mismatches against linebackers. After the catch, Arroyo shows good vision and enough strength to break tackles. As a blocker, he displays proper technique and competitive toughness despite his leaner frame.","Athleticism, route-running ability, reliable hands, seam-stretching capability, yards-after-catch ability, red zone potential, competitive toughness, mismatch potential","Still developing as a blocker, needs improved play strength at point of attack, occasionally body catches instead of using hands, needs more consistent blocking technique",6-5,250,4.69,,,,,33,22,,10,,81.875
Omarr Norman-Lott,"Norman-Lott is a powerful interior defensive lineman with quickness and disruptive ability. He possesses good first-step quickness for his size, with the ability to shoot gaps and penetrate into the backfield. Norman-Lott demonstrates good hand usage and leverage awareness, effectively shedding blocks to make plays. His motor runs consistently, pursuing plays with effort and finishing tackles with authority. In run defense, he anchors effectively against double teams and maintains gap integrity with good discipline.","First-step quickness, power, hand technique, motor, run defense ability, block shedding, gap integrity, disruptive potential","Still developing pass rush moves beyond bull rush, can improve conditioning for more consistent three-down impact, occasionally plays too high affecting leverage",6-2,291,5.05,5.94,,,,,,,,,
Deone Walker,"Walker is a massive interior defensive lineman with rare movement skills for his size. He possesses exceptional power at the point of attack, effectively anchoring against double teams and resetting the line of scrimmage in the run game. Walker shows surprising quickness for his size, with the ability to shoot gaps and affect plays in the backfield. His length is a significant asset, allowing him to control offensive linemen and keep them off his frame. Walker's motor runs consistently, pursuing plays with effort despite his massive frame.","Exceptional size and power, anchor against double teams, surprising quickness for size, length, run-stuffing ability, developing pass rush, block shedding, gap control","Limited range outside the tackle box, still developing stamina for consistent three-down impact, can improve pass rush repertoire beyond power moves, occasionally plays too high",6-7,331,5.1,3.75,,,,34.25,,104,10.625,25,84.125
Cameron Williams,"Williams is an athletic offensive tackle with excellent length and developmental upside. He displays good initial quickness in pass protection, with the lateral agility to mirror speed rushers. Williams' length is a significant asset, allowing him to establish first contact and keep defenders at bay. In the run game, he demonstrates good mobility to reach defenders on the perimeter and work to the second level. Williams shows competitive toughness, finishing blocks with physicality and looking for work downfield.","Length, athletic movement skills, lateral agility, second level mobility, competitive toughness, developmental upside, run blocking mobility, recovery ability","Still developing technical consistency in pass protection, needs to improve hand placement, occasionally plays too high affecting leverage, adding functional strength",6-6,317,5.4,,,,,34.5,,,11.375,,84.5
Darius Alexander,"Alexander is a powerful defensive lineman with impressive anchor ability and run-stopping prowess. He possesses excellent upper and lower body strength to hold his ground against double teams and maintain gap integrity. His hand usage is advanced, showing the ability to stack, shed, and locate ball carriers quickly. Alexander demonstrates good initial quickness for his size, allowing him to occasionally penetrate and disrupt plays in the backfield. His motor runs consistently hot, pursuing laterally and downfield with good effort. In pass rush situations, he shows the ability to collapse the pocket with his bull rush and is developing additional moves to complement his power.","Anchor strength, run defense, hand usage, gap integrity, motor, bull rush power, play strength, stack and shed ability","Pass rush repertoire needs expansion beyond power moves, lateral agility can improve, sometimes plays with high pad level, change of direction in space is limited, pass rush conditioning needs development",6-4,305,4.95,9.16,1.72,4.79,7.6,34,28,111,10,31,82.875
Wyatt Milum,"Milum is an athletic offensive tackle with excellent movement skills and developing technical refinement. He displays smooth footwork in pass protection, with the lateral agility to mirror speed rushers and recover when initially beaten. Milum shows a strong punch and improving hand placement, with the length to keep defenders at bay. In the run game, he demonstrates good initial quickness and the ability to work to the second level, connecting on linebackers and defensive backs in space.","Athletic movement skills, lateral agility, length, recovery ability, second level mobility, competitive toughness, developmental upside, run blocking mobility","Still developing play strength and anchor, needs more consistent hand placement in pass protection, occasional lapses in technique when facing counter moves",6-6,313,5.27,8.08,1.84,4.69,,32.125,,,10.25,,79.5
Quinshon Judkins,"Judkins is a complete running back with an impressive blend of power, balance, and vision. He runs with excellent pad level and leg drive, consistently falling forward and breaking tackles for extra yardage. Judkins demonstrates outstanding vision and patience, setting up blocks and finding cutback lanes effectively. His contact balance is exceptional, bouncing off tackles and maintaining momentum through traffic. As a receiver, Judkins shows developing hands and route-running ability, creating mismatches against linebackers in coverage.","Vision and patience, contact balance, power through tackles, tackle-breaking ability, three-down potential, short-yardage effectiveness, competitive toughness, consistency","Top-end speed is good not elite, still developing as a receiver, needs refinement in pass protection technique, occasionally tries to create too much instead of taking available yards",6-0,221,4.48,9.9,1.51,,,30.25,,132,9.25,38,73.5
Jayden Higgins,"Higgins is a physically imposing receiver with excellent size, length, and developing route-running ability. He uses his frame effectively to box out defenders and create throwing windows for his quarterback. Higgins shows improving route-running detail, with better breaks and separation at the top of routes. At the catch point, he displays good body control and adjustment to the ball in the air. Higgins' hands are reliable, plucking the ball away from his frame and securing it through contact. After the catch, he shows good vision and strength to break tackles.","Size and length, contested catch ability, red zone effectiveness, hands, developing route-running, physicality, catch radius, competitive toughness","Still developing route detail against press coverage, separation quickness is good not great, needs to improve release package, can be more consistent as a blocker",6-4,214,4.47,9.63,1.53,,,33.125,,128,9.125,39,80
Josaiah Stewart,"Stewart is an explosive edge defender with impressive burst, bend, and developing technical refinement. His first-step quickness stresses offensive tackles, and his flexibility allows him to turn tight corners around the edge. Stewart shows developing hand usage, with improving technique to disengage from blocks. In run defense, he sets a solid edge with the strength to hold his ground against tight ends and tackles. Stewart's motor runs consistently hot, pursuing plays with relentless effort and finishing tackles with authority.","First-step explosion, bend around the edge, motor, pursuit effort, developing hand technique, closing burst to the quarterback, athletic traits, developmental upside","Still adding functional strength particularly against the run, needs to expand pass rush arsenal, can improve consistency against the run, developing counter moves",6-1,249,4.7,,,,,31.875,,,9.5,,79
Darien Porter,"Porter is an athletic defensive back with excellent size, length, and developing coverage skills. He possesses the speed to carry receivers vertically and the hip fluidity to change direction smoothly. Porter shows improving route recognition, anticipating breaks and closing quickly on underneath routes. His ball skills continue to develop, showing better timing and play on the ball in the air. Porter tackles with good form, breaking down in space and taking proper angles in pursuit.","Size-length-speed combination, athletic traits, developing ball skills, tackling technique, competitive toughness, man coverage potential, developmental upside","Still developing route recognition consistency, needs to improve zone awareness, can enhance press technique, occasional false steps in transition",6-3,195,4.3,9.99,1.49,4.04,6.71,33.125,,131,9,36,80
Elic Ayomanor,"Ayomanor is a physically gifted receiver with excellent size, strength, and playmaking ability. He uses his frame effectively to shield defenders and make contested catches in traffic. Ayomanor shows developing route-running precision, with improving breaks and separation at the top of routes. His hands are reliable, plucking the ball away from his frame and securing it through contact. After the catch, Ayomanor displays good power and balance, breaking tackles and creating additional yardage. His competitive toughness shows in his willingness to work the middle of the field and block in the run game.","Size and strength, contested catch ability, run-after-catch power, developing route-running, competitive toughness, red zone effectiveness, blocking willingness, physical traits","Still refining route details, can improve release package against press, occasionally body catches, needs more consistency creating separation",6-2,206,4.44,9.71,1.58,,,32.375,,127,10,38,78.375
Bradyn Swinson,"Swinson is an athletic edge defender with good burst, power, and developing technical refinement. He possesses good first-step quickness to stress offensive tackles, complemented by the strength to set a firm edge in the run game. Swinson demonstrates developing hand usage, with improving technique to disengage from blocks. His motor runs consistently hot, pursuing plays with relentless effort and finishing tackles with authority. In run defense, he maintains gap integrity with good discipline.","First-step quickness, edge-setting ability, motor, pursuit effort, developing hand technique, run defense discipline, physical traits, competitive toughness","Still developing pass rush plan, needs to expand move arsenal, can improve bend around the edge, developing counter moves when initial rush is stalled",6-4,255,4.8,,,4.33,7.13,33.375,,,9.875,,81.25
Joshua Farmer,"Farmer is a disruptive interior defensive lineman with good quickness and developing power. He possesses quick first-step quickness that allows him to penetrate gaps and affect plays in the backfield. Farmer shows developing hand usage, with improving technique to shed blocks and affect the passer. His motor runs consistently, pursuing plays with effort and finishing tackles with authority. In run defense, Farmer demonstrates the strength to hold his ground and maintain gap integrity.","First-step quickness, penetration ability, motor, developing hand technique, pursuit effort, interior disruptiveness, gap integrity, athletic traits","Still adding functional strength, needs to expand pass rush moves beyond initial quickness, can improve consistency maintaining gap discipline, developing counter moves",6-3,305,5.11,7.89,1.77,,,35,26,112,10.5,29,83.375
Jack Bech,"Bech is a versatile receiving threat with reliable hands and excellent route-running precision. He creates separation with detailed footwork and subtle body manipulation at the top of routes. Bech displays outstanding body control and adjustment to the ball in the air, making difficult catches look routine. His hands are exceptional, rarely dropping catchable passes and plucking the ball away from his frame. After the catch, Bech shows good vision and elusiveness to create additional yardage. His football intelligence is evident in how he finds soft spots against zone coverage.","Route-running precision, reliable hands, body control, yards-after-catch ability, positional versatility, competitive toughness, football intelligence, zone coverage awareness","Lacks elite size or top-end speed, occasionally struggles against physical press coverage, could improve play strength, still developing as a blocker",6-1,214,4.55,9.5,,4.21,6.84,31.5,19,125,9,34,75
Jalen Royals,"Royals is a dynamic playmaker with exceptional speed, acceleration, and big-play ability. He creates separation with his elite burst and route-running precision, consistently stressing defenses vertically. Royals displays good body control and adjustment to the ball in the air, tracking deep passes effectively. His hands continue to develop, showing more consistency catching the ball away from his frame. After the catch, Royals is electric, with the vision and elusiveness to turn short completions into explosive gains.","Vertical speed, acceleration, big-play ability, route-running precision, tracking deep balls, yards-after-catch ability, competitive toughness, playmaking instincts","Slender frame may limit durability, still developing consistency with hands, can improve play strength through contact, needs refinement as a blocker",6-0,205,4.42,9,1.49,,,30.125,13,,9.5,,73.75
Jordan Burch,"Burch is a versatile defensive front player with excellent size, strength, and athleticism. He demonstrates good first-step quickness for his size, with the ability to penetrate gaps and affect plays in the backfield. Burch displays good hand usage and leverage awareness, effectively shedding blocks to make plays. His motor runs consistently hot, pursuing plays with relentless effort and finishing tackles with authority. In run defense, Burch sets a strong edge and maintains gap integrity with good discipline.","Size-strength-athleticism combination, versatility along defensive front, hand usage, motor, edge-setting ability, run defense discipline, pursuit effort, physical traits","Still developing as a pass rusher, needs to expand move arsenal, can improve bend around the edge, occasional lapses in gap discipline",6-4,279,4.67,,1.66,,,33,,,9.5,,79.375
Harold Fannin Jr,"Fannin is an athletic tight end with impressive receiving skills and developing blocking ability. He creates separation with fluid route running and good footwork at the top of routes. Fannin's hands are reliable, catching the ball cleanly away from his body and securing it through contact. His athleticism allows him to be a vertical threat up the seam, with the speed to stretch defenses and create mismatches against linebackers. After the catch, Fannin shows good vision and enough strength to break tackles. As a blocker, he displays proper technique and competitive toughness despite his leaner frame.","Athleticism, route-running ability, reliable hands, seam-stretching capability, yards-after-catch ability, red zone potential, competitive toughness, developmental upside","Still developing as a blocker, needs improved play strength at point of attack, occasionally body catches instead of using hands, needs more consistent blocking technique",6-3,241,4.71,7.77,1.56,4.39,6.97,32.25,22,118,9.25,,79.25
Dylan Sampson,"Sampson is an explosive running back with exceptional speed, quickness, and big-play potential. He possesses elite acceleration, hitting top speed quickly and outrunning pursuit angles. Sampson demonstrates good vision and patience, setting up blocks and finding cutback lanes effectively. His contact balance continues to improve, showing better ability to run through arm tackles and maintain momentum after contact. As a receiver, Sampson displays natural hands and route-running ability, creating mismatches in space.","Elite acceleration and speed, big-play ability, vision, receiving skills, elusiveness, third-down potential, competitive toughness, versatility","Smaller frame may limit durability between the tackles, still developing power in short-yardage situations, needs refinement in pass protection technique",5-8,200,4.35,6.6,,,,30.5,13,124,8.75,35,73
Jalen Milroe,"Milroe is a dynamic dual-threat quarterback with exceptional athleticism and developing passing skills. His elite speed and acceleration make him a constant threat as a runner, whether on designed runs or scrambles. Milroe possesses impressive arm strength, able to drive the ball downfield and fit throws into tight windows. His release has quickened, allowing him to get the ball out faster under pressure. Milroe demonstrates improving pocket presence, showing better ability to go through progressions while maintaining proper depth. His leadership and competitive toughness are evident in how he performs in critical situations.","Elite athleticism as a runner, exceptional arm strength, quick release, big-play ability, leadership qualities, competitive toughness, improvisational skills, developmental upside","Still developing consistency with accuracy, needs to improve processing speed and anticipation, occasionally relies too much on athleticism, developing field vision as a passer",6-2,217,4.5,,,,,30.625,,,9.375,,76.625
Kyle Kennard,"Kennard is an explosive edge defender with excellent first-step quickness, bend, and motor. His burst off the line stresses offensive tackles, forcing them to overcompensate for his speed. Kennard demonstrates developing hand usage, with improving technique to disengage from blocks. His flexibility allows him to flatten to the quarterback after turning the corner, closing quickly to finish plays. In run defense, Kennard sets a solid edge with improving strength and leverage awareness. His relentless motor shows in his pursuit effort, chasing plays from the backside and never giving up on the play.","First-step explosion, bend around the edge, motor, pursuit effort, closing burst to the quarterback, developing hand technique, athletic traits, pass rush potential","Still adding functional strength particularly against the run, needs to expand pass rush arsenal, can improve consistency against the run, developing counter moves",6-4,254,4.73,8.57,1.63,,,34,23,,9.75,,81.5
Gunnar Helm,"Helm is a well-rounded tight end with good size, hands, and blocking ability. He displays solid route-running skills, creating separation with precise breaks and good footwork. Helm's hands are reliable, catching the ball cleanly away from his body and securing it through contact. As a blocker, he demonstrates proper technique and competitive toughness, effectively sealing the edge in the run game and showing the ability to move defenders. Helm's football intelligence is evident in how he finds soft spots against zone coverage and adjusts his routes based on coverage.","Balanced skill set, reliable hands, blocking technique, size, football intelligence, competitive toughness, red zone effectiveness, consistency","Lacks elite athleticism or separation quickness, still developing as a vertical threat, can improve play strength at the point of attack, needs refinement in route details",6-5,241,4.84,4.32,1.69,4.4,7.15,32.75,,,9.875,30,79.5
Andrew Mukuba,"Mukuba is a versatile defensive back with excellent instincts, quickness, and physicality. He processes information rapidly, reading plays and triggering downhill with decisiveness. Mukuba displays fluid movement skills, with the ability to change direction smoothly and match up in coverage. His tackling is a strength, taking proper angles and finishing with good form and physicality. Mukuba demonstrates versatility to play multiple positions in the secondary, with the awareness and football IQ to handle various responsibilities.","Instincts, quickness, tackling ability, versatility, play recognition, football intelligence, physicality, competitive toughness","Size limitations may affect matchups against larger tight ends, occasionally overaggressive leading to missed tackles, still developing consistency in deep coverage",5-11,186,4.45,5.12,1.53,,,30,,,9,,75.375
Ozzy Trapilo,"Trapilo is a big-bodied offensive lineman with good strength and developing technical refinement. He displays solid initial quickness in pass protection, with a strong anchor to absorb bull rushes. Trapilo shows improving hand placement and the ability to reset when initially pushed back. In the run game, he generates movement at the point of attack with leg drive and competitive toughness. Trapilo's football IQ is evident in how he handles stunts and blitzes, working well in combination with his fellow linemen.","Size and length, anchor strength, improving hand placement, awareness of stunts/blitzes, drive blocking ability, competitive toughness, developmental upside","Athletic limitations against elite quickness, needs more consistent hand placement, can improve body control in space, occasionally plays too high affecting leverage",6-8,316,5.21,8.88,1.77,4.7,7.71,33,,106,10.375,,81
